{
  "ai_generated": true,
  "ai_confidence": 0.9,
  "detection_sources": ["commit-trailer"],
  "evidence_tier": "attested",
  "technical_debt_delta": 0.4,
  "test_coverage": -1,
  "patch_coverage": -1,
  "mutation_score": -1,
  "branch": "claude/add-endpoint",
  "changed_files": ["src/api/handler.py"],
  "issues": []
}
